{
  "$schema": "../schemas/theme.v1.json",
  "name": "aqua-card-3col",
  "page": {
    "size": "A4",
    "margins_mm": { "top": 10, "right": 10, "bottom": 10, "left": 10 }
  },
  "palette": {
    "primary": "#0891B2",
    "text": "#0F172A",
    "muted": "#64748B",
    "bg": "#FFFFFF"
  },
  "fonts": { "arabic": "NotoNaskhArabic", "latin": "Inter" },
  "layout": [
    { "block_id": "header_name" },
    { "block_id": "contact_info" },
    { "block_id": "key_skills" },
    { "block_id": "languages" },
    { "block_id": "text_section" },
    { "block_id": "projects" },
    { "block_id": "education" }
  ],
  "frames": {}
}
