{
  "$schema": "../schemas/theme.v1.json",
  "name": "default",
  "page": {
    "size": "A4",
    "margins_mm": { "top": 12, "right": 12, "bottom": 12, "left": 12 }
  },
  "palette": {
    "primary": "#0F766E",
    "text": "#111827",
    "muted": "#6B7280",
    "bg": "#FFFFFF"
  },
  "fonts": { "arabic": "NotoNaskhArabic", "latin": "Inter" },
  "layout": [
    { "block_id": "header_name" },
    { "block_id": "contact_info" },
    { "block_id": "key_skills" },
    { "block_id": "languages" },
    { "block_id": "text_section" },
    { "block_id": "projects" },
    { "block_id": "education" }
  ],
  "frames": {}
}
